style,section,deliver_t,title,content,reply_c,reply_t
建议,建设局,2015/7/31 15:54,2015年6月10日建议将陈井村二里118号危房拆除以保障周边居民安全，至今未处理,2015年6月10日建议将陈井村二里118号危房拆除以保障周边居民安全（编号:MD###5135）内容：陈井村二里118号危房为民国时期建筑，解放后被征用做学校教学楼。现在该楼房屋顶长着大榕树，屋顶已坍塌，墙壁开裂。该危房属政府国有资产，长年荒废，遇到台风很可能倒塌，威胁周边居民安全。建议政府本着为人民服务的原则尽快将该处危房拆除，以保障周边居民安全。2015年6月25日，网站答复意见为：危房办已经前去处理，但至今未处理。近期为台风多发季节，希望政府部门能及时处理，保障周边居民安全，谢谢！,您好，您的政民互动转办单已经收悉，我局已派工作人员到现场查看，您所述情况属实，该房屋年久失修，再加上被榕树所侵占更存在一定的危险性。若是要拆除该房屋，则长在房屋上的大榕树也需要砍掉，才能保证拆除时临近房屋的安全。我局建议对该房屋进行围护，减除公共安全隐患。恰逢陈井村被列为2015年美丽乡村，我局将建议美丽乡村建设业主单位请专业设计人员对围护方案进行设计，确保围护方案的可行性。,2015/8/12 16:47
建议,"公安分局,公路分局",2015/7/31 21:14,路口改造或者加设红绿灯,滨水小区二地块旁的集美大道有个调头区，由于过往直行车辆车速高，过路口时不减速，同时中间路还有BRT快1线经过，导致这个路口很容易发生交通事故和堵车，我自己就目睹过好几起掉头车辆和直行车辆碰撞的事故，建议政府部门能在这个路口加设红绿灯或者其他措施，保障车辆能够有序行驶，期待政府能解决一下此问题,该转办件所述涉及集美大道道路改造工程，代建单位为厦门百城建设投资有限公司。经向百城公司了解，集美大道设有两级调头提醒标识、沿线路面标示线均有按照规范划线，但交通事故仍有发生，主要是因为该道路是进出岛的主要通道，人流量车流量大，而经常有车辆违规行驶，造成交通隐患，建议相关部门加强车辆行驶管制。关于双向调头区集中设置的问题，在集美大道华侨大学至诚毅学院间设置调头区是考虑到道路两侧的学校和居民车辆行驶的需要。由于集美大道上有BRT专用车道，如果双向调头分开设置，则BRT车道要有两个开口，存在安全隐患，且影响BRT通行。而在华大与诚毅学院间设置调头区，势必会与BRT车道交叉。综合上述原因，经多个部门共同研究确定将双向调头区集中设置在BRT匝道口。关于设置红绿灯，本项目未在此处规划设置红绿灯，如需设置，建议转交警部门协调处理。,2015/8/12 16:34
建议,"建设局,公路分局,集美城发",2015/7/31 21:39,孙坂公路环境,孙坂公路近期环境卫生情况整洁干净了很多。之前看那些打扫的工人，总是随便扫扫就回去了，现在打扫变得很干净。不过在港头菜市场那边到软件学院还是有的地方比较脏的。但是，整体来说环境干净了很多，搭929的时候可以明显的感受到。,根据建议内容，已要求现场作业人员加强港头菜市场至软件学院段的保洁力度。,2015/8/17 16:40
建议,交通局,2015/8/3 10:13,海德公园、海上五月花附近的公交线路什么时候才能建好？,现在到同安的BRT都已经增开快5了，美山小学也都快开学了。为什么附近的公交线路还没建好呢？而且从东安站到招商海德公园、海上五月花的链接线也没有，即使要到嘉庚体育馆也没有对应的公交车，每次只能打摩的，出行非常不便，而且也很危险。现在两个小区的入住人员一直在增加，麻烦尽快建立起完善的交通，方便大家安全出行！,关于海德公园、海上五月花公交线路问题，我局已与侨英街道、区城发公司、公交公司现场勘察，拟在海上五月花周边新建一座公交临时首末站，同时请城发公司尽早完善周边道路。相应公交线路将根据首末站建设及道路完善状况适时开通，我局已就开通海上五月花公交线路方案向区政府进行专项报告。,2015/8/7 16:47
建议,交通局,2015/8/3 15:19,杏林仰后公交车首末站能不能规划到中海锦城边上,聚镇，中海锦城国际已交房入住，锦园社区，杏北小学，人流量大，建议将仰后站首末站公交站起点设在，中海和聚镇交叉口，靠水厂那边的空地上，方便几大社区市民出行。,公交场站（枢纽站、首末站）的建设涉及规划、土地使用性质等多方面因素，需要多部门共同确定后方可实施。,2015/8/11 11:25
建议,"集美街道,集美中队",2015/8/4 14:02,岑头街路面破损堆满建筑材料,岑头街5号对面的广场空地上，堆了许模板和钢筋，存在安全隐患。恳请街道马上清理这些建筑材料并且恢复原来的宣传栏，恢复路面。给民众出行方便，也美化了环境.,关于岑头街7号对面违建的问题建议转执法局处理，关于恢复原来宣传栏的问题，经相关工作人员现场勘查了解，该处无法恢复宣传栏。,2015/8/24 11:55
建议,规划分局,2015/8/4 17:29,杏西片区和杏北片区交通不畅,杏西和杏北人口越来越多，但是两个区域只有杏林北路和西滨路连接，是否有规划在增加新通道,目前，杏林主干道都在提升改造，并完善片区内路网建设，杏林西路将与海沧连通，西溪路将建设为城市快速路，其他与主干道连接的支路已在逐步完善中。,2015/8/7 16:50
建议,"交通局,建设局,交通局",2015/8/5 8:54,105公交车医高专出发时间太晚,你好，由于上班要转车，所以要早起坐车，但是发现医高专去红星美凯龙的105，发车时间是7：00，大部份公交车都是六点20始发的，建议105医高专往红星美凯龙的发车时间提早，更改为6：30，或者6：40始发。不然每天要从城市学院走去前埔南区转车，谢谢。,105路为公交集团思明公司运营线路，建议向该公司或市公交集团予以反映。,2015/8/17 16:35
建议,"建设局,后溪镇,建设局",2015/5/19 15:06,厦门北站北广场动工的问题,厦门新闻在年初在报道厦门火车站和北站会同时动工，可是现在厦门火车站都快完工了，北站到现在都没有一点动静，到处是杂草众生，这就是岛内外一体化的表现？所以这就是为什么居民不愿意到岛外，这就是你们政府部门的不作为的工作表现，这样就让岛内和岛外人口差异的问题，你们说谁会愿意到岛外去？希望政府部门加大对岛外的进度，不要伤了居民的心,,
建议,建设局,2015/5/20 12:40,强烈建议杏北建行公交站间加设人行天桥,杏北建行公交站是杏林的一个大站，大部分杏林的公交车都要经过这里，上下班高峰期人流量很大，很多人也在这个站点中转换乘，双向站台之间目前只有一条人行斑马线通过，也没设红绿灯（明达玻璃东门口），杏北路车流量很大，大车小车摩托车都多，行人很危险，本人多次看到行人在过斑马线时被车撞飞，有一次还是一个带小孩的妈妈倒在血泊中，一个家庭又要面临不幸了，所以强烈建议这两边公交站间加设人行天桥，临时天桥也可以，再不行设个红绿灯也可以，以保护行人生命安全。,我们将与规划、交警等相关部门协调并研究建人行天桥的可行性及必要性，如有必要将尽快予以建设。,2015/5/29 11:31
建议,公路分局,2015/5/23 19:09,滨水二里东侧高速路隔音墙问题（田集连接线）,曾经投诉过这段高速噪音扰民问题，得到的回复是为了美观，加之车道多，路边乃高层建筑，隔音效果不佳，所以将原有的隔音墙拆除掉。那么，请问，你们是否有经过相关部门的检测确定隔音墙对噪音起不到作用？有相关数据支持你们的想当然吗？如果以上谬论成立的话，那么仙岳高架桥沿途的所有隔音墙是不是也该拆除掉？因为两边也都是高层建筑啊，起不到隔音效果，影响美观。将原来就有的隔音墙拆除就是为了美观，纯粹是胡来，置民众的利益于不顾，死要面子。总之，高速路因为车速极快，噪音严重扰民，请各位领导们救民众于水深火热中！拜托！,该转办件所述涉及田集连接线道路改造工程，代建单位为厦门百城建设投资有限公司。经向百城公司了解，由百城负责的高速公路田集连接线拓宽改造工程滨水段声屏障工程已于2012年9月完成施工。2014年9月根据集美新城开发建设指挥部办公室会议纪要（[2014]2号）—主任办公会议纪要第六条协调意见，会议明确由百城公司在该路段两侧种植高大绿化苗木替换原有声屏障，以提升沿线景观效果。,2015/6/1 16:52
建议,教育局,2015/5/24 13:15,集美幼儿园岑东分园,时下，岑东分园要招一个班，初步计划6月1日开学。建议开学日期推迟到9月1日。理由如下：1、岑东园目前还在装修，并且操场上的大型设备还未进场，感觉不具备开园条件。2、如果6月开学，7月就放假了，对园方来说也是不经济的。3、如果6月开学，7月就放假了，对家长来说很纠结：这意味着7月和8月孩子无法上幼儿园。3、这些孩子大多正在私立上学，中途转园对孩子教育的延续性似乎不好。4、另外，中途转园使得在私立发生的预交费用可能存在退费难问题。很多家长希望9月正式开学，我们认为这对于园方、家长以及孩子都是最好的选择，请领导三思！,经了解，岑东幼儿园于6月1日开办。家长可按照招生要求，根据自身实际，选择6月或9月入学。如有疑问直接电联幼儿园6686706咨询。,2015/6/1 17:21
建议,人社局,2015/5/24 19:03,希望厦门金龙联合汽车工业有限公司合理安排,领导好，厦门金龙联合汽车工业有限公司经常以生产交期为由让我们加班，甚至休息日都不固定，比如5月3号上班到5月24才休，我们一线的工作时间是早上8:00-12:00下午13:00-17:00然后晚上流水线要从17:45-21:45，这样工作时间多长啊，这是重工业啊，希望领导可以着手协调让我们一线员工，能够充分得到休息，不是说给加班费的问题，真是很累啊，金龙领导没把一线员工当做人来看，希望区领导替我们出力，若是查工时，请到总装车间查看，谢谢。,关于员工反映厦门金龙联合汽车工业有限公司工作时间与休息时间安排不合理的问题，经调查，由于公司近期订单任务较重，时间紧迫，因而存在个别车间一线工人加班时间较长的现象，但不存在强迫加班及加班费支付不足等问题。我劳动监察大队已责令该公司进行了整改，公司采取了临时扩招员工，对生产安排进行合理调整，提升员工收入水平，并积极与员工进行沟通等措施，尽最大努力满足员工的需求。,2015/7/2 17:36
建议,侨英中队,2015/5/25 15:34,执法局，请你们认真点，不要再复制黏贴了。,同集路集大到孙厝路口这段路已经被烧烤摊完全占领了，多次反映给你们，你们都是同样一段话“经查，关于“同集南路集美大学至孙厝路口烧烤摊占道”的投诉，我局侨英中队执法人员已暂扣经营者的桌椅，并对经营者进行劝导与教育，减少油烟扰民行为。中队将继续加强巡查，对占道经营及时予以纠正。”，请不要把百姓当弱智忽悠了；没有执法就是没有执法，天天用同一段话来复制黏贴，你们这个回复的工作人员也是一定水平都没有，早点开除算了。,经查，关于“同集路集大到孙厝路口烧烤摊占道”的投诉，接报后，我局侨英中队执法人员立即前往现场，已对当事人进行思想教育，并将再组织整治。,2015/5/29 15:08
建议,集美城发,2015/5/25 23:10,晚上冒污水,集美大学财经学院宿舍靠集美幼儿园路口，一到晚上又再冒化粪池的水！一直冒，流得整条路都是，好臭!!!赶快处理,经现场查看，由于该处污水管道堵塞，导致粪池的水处上冒，已安排工作人员于5月26日完成疏通。,2015/6/1 11:56
建议,"集美城发,路灯所",2015/5/26 11:58,路灯维修,集美北工天安路祥和雅筑一期业和外口公寓相临路口的路灯不亮，请有关部门能维修一下。,,
建议,侨英街道,2015/5/27 9:24,体育强国需要从基层做起,中国梦，体育强国需要从基层做起。那些年错过的大雨，、、、、、、这些天都还给你了。、、、、、、五月时节雨纷纷，今天、明天、后天还有雨。、、、、、、想运动一下，还没地方。周边村庄的铁皮篮球场都已建好，我兑山村为何没有建呢？心里那个羡慕嫉妒狠啊！基层的侨英街道为何办事效率那么的慢。为何后溪镇的村庄都盖好了，我们的都还在研究当中？？？上次，看有的村民也有建议，可回答还是那么的官方。有那么难吗？难道还要公投？请快点好吗？,近年来，为丰富社区居民文体活动，侨英街道陆续建设了一批篮球场，兑山社区新建了4个球场，基本满足居民需求，大多属室外篮球场，因为钢构篮球场要求很严格，而且还受片区规划的限制，球场钢构后将进行封闭式管理，人员和车辆不能通行，经街道办和专业设计单位筛选，兑山社区符合建设条件目前只有南尾井球场，街道办已完成方案设计，正在办理招标手续，预计今年10月份建成。感谢您关心社区建设。,2015/5/27 16:44
建议,交通局,2015/5/27 14:52,在溪南社路口增设一个公交车站点,希望能够在溪南社的路口增加一个公交车站点，方便村民出行，不然每次都要走好几百米才能到涌泉公交车站，太远了，赶车的话都得用跑的。,溪南社位于国道324线旁，由于国道324线早期未规划建设公交辅道及港湾式公交候车亭，现有公交站点均为临时停靠点，主要是为了满足沿线民众的出行需求。,2015/6/5 15:33
建议,"公路分局,建设局,公路分局",2015/5/27 17:48,杏南路与杏滨路路灯建议,自从前几天听说有村民在杏滨路骑车过马路时候被过路的车子撞上，并且造事车辆逃逸，过后几天试着在杏南路往杏滨路（现围挡）在杏南路围挡区域都已经道路变窄了，可是还有违章停车的车里，影响了围挡路段的通行。以及成为了一个安全隐患，经常有人突然冒出来，没路灯都已经在该路段形成了安全隐患，先违停车辆是在隐患上更加升级，强烈要求该路段行政单位进行违停车辆的严惩，建议路灯部门对该路段的路灯启动临时预安，那附近的村民跟租户们至少出行可以多分安全感，不要每天都是提心吊胆的出行，对于杏滨路新阳桥头至高浦红绿灯路段，施工单位是否可以在赶工期是钱提下，先对安全上多下点功夫，该路段现在无路灯，监控探头太少，大部分车辆行驶速度过快，是否可以与相应部门商量路灯的零时建设，以及监控多些，多弄些减速带，车是铁，人是肉，没发生事情相关部门不会总是，但是等到事情发生在来解决那就晚了，希望施工单位，以及集美区政府的相关部门可以对现杏林所有的施工路段进行安全优化，还给村民居民，租户们一个安全的心。相信相关部门可以给我们看到实际的改变的，简单的反光贴，只有微弱的作用，该路段现在很多人开车都是远光灯，希望交警部门可以对该路段进行实际的观察，也希望其他部门也出来关心关心，谢谢。,该转办件所述涉及杏滨路道路改造工程，代建单位为厦门市市政建设开发总公司。经向市政公司了解，杏滨路提升改造工程是厦门市规划“两环八射”快速路网重要组成部分，属于双环快速走廊中的内环路段，为2015年市重点工程。工程起点新阳大桥桥头以东380m，终于杏林互通立交，路线长3.753公里。,2015/6/5 15:31
建议,公安分局,2015/5/27 18:05,电梯安全问题,你好！我是两个孩子的父亲，我住在集美泉水湾，能不能请政府建议一下嘉庚体育馆的新华都超市电梯做上防护网，我们这边都是生活区有很多小孩怕有危险。,2、.建议事主可直接向新华都提出建议；2、.我所也会转达新华都建议加强安全防护；,2015/6/4 16:33
建议,"集美城发,路灯所",2015/5/27 21:48,路灯问题,厦门北站珩圣路往圣果路红绿灯十字路口这段路灯两排有几十盏路灯，但很多都是瞎子灯，我数了一下只有两盏亮着，该段路面漆黑一片。请区政府有关部门派人检查更换灯炮。,电缆故障，已安排抢修。,2015/5/29 15:36
建议,卫计局,2015/5/31 17:53,申请设置医疗机构,首先感谢卫计局今年放开了医疗机构申请，并取消了距离限制，加快了集美区医疗建设的步伐，我们也积极响应政府号召，申办符合卫计局要求的正规医疗机构，为人民服务；但在今年的申办过程中遇到一个棘手的问题，申办材料中有一项是要有失业证，本来这项的设立是让医务工作者从原单位离职，避免多点执业，但外籍人员在办理失业证时，须停保后回户籍所在地申请，这点和厦门外籍人员申办户口里的一项“连续交满医社保八年，中间不得中断”相冲突，望卫计局能理解，急盼在下次开放受理时能否将此项改为“原医疗机构离职证明”或其他的更好方案，谢谢！,今后申请人在申请医疗机构设置和执业登记时如果无失业证的，提交原单位的离职证明即可。因未留电话，无法反馈。,2015/6/4 16:13
建议,交通局,2015/6/1 14:42,莲花尚院出行问题,目前莲花尚院已入即将两年，可是出行一直是大家的难题，希望能加快BRT站台建设及公交车辆，解决大家出行难的问题。,我市BRT站点的建设由市政集团负责实施。关于BRT大学城站点的启用，我所也多次与集美新城指挥部、市交通主管部门进行沟通协调。经了解，目前BRT大学城站已在进行重新修缮，我所也将持继关注该站点的进展情况。,2015/6/9 10:19
建议,交通局,2015/6/1 15:32,建议公交车959路在古龙御景设站停靠，解决几百户家庭交通问题,我们古龙御景这里一二期加起来几百户上千户人家，回来一点都不方便，比如去新华都转车，从新华都只能走回来，大概1.5公里走路需要快半小时才到，从北站回来要到T4候机楼转车回来横跨2次集美大桥。公交车959路开往厦大方向的时候在L21连接线的凤林站也设个站停一下，开往喜盈门的时候可以在浔江北路开往海凤路附件设一个站，这样不仅方便我们，对于公交来说也没有绕路。本身959路嘉庚体育馆站和集美中学站距离3公里多距离较远，设站合理。（我画的图纸一直按文件上传一直就绪状态就是上传不上来。。）如果有关部门能够解决就非常感谢！,959路原先运行路线为集美喜盈门始发经乐天路、海凤路、浔江北路、乐海路开往厦大。由于浔江北路与浔江路连接段跨线桥施工，跨线桥两侧辅道施工尚未完工，致使959路临时绕行其他道路运营。,2015/6/9 10:18
建议,交通局,2015/6/1 15:54,希望公交集团能保证996在上下班高峰期班次多一点,我是一个在高浦小学上课的学生家长，学校门口就一班996，还非常不好等，小孩没有手机可以查公交车时间，为了不迟到，只能是提前一个小时就要在站牌上等车（因为公交车有时候托班了也不会立刻加开新的班车，只有等下一班），我们也尝试了很多方式，包括按照车上贴的发车时间计算，但是永远不能搭到车，电话咨询得到的答案是只有首班车跟末班车是准时的，其他不能保证，最近为什么996不能像906、931、907一样是集美的公交车他们就能够按照车上的计划时间发车，我们不懂是什么原因，只求公交集团能重视在7-8点，11-12点，2-3点、5-6点的时候能保证车辆的正常运行，不要让小孩子把宝贵的时间浪费在等车上，我们家长忙确实没办法专职接送，只能有赖于公交车了。希望领导们予以解决。谢谢~,996路现有公交运营车辆5辆，班次间隔为25分钟左右。由于近期996路优化调整，绕行万科生活片区，加上杏滨路、杏东路延伸段道路改造，交通拥堵现象严重，对班次造成较大影响。我所将责成公交公司合理安排车辆班次，最大限度保障民众的出行。,2015/6/9 15:28
建议,公路分局,2015/6/1 20:34,集灌路绿化带杂草成树了,集灌路凤凰花城一带及集灌路与集美北大道交叉路口一带中间绿化杂草长期没人管理已经比绿化树还要高了有点夸张了！应该要定期管理才对否则绿化是浪费！,该转办件所述涉及国道319线集灌路道路改造工程，代建单位为厦门路桥建设集团有限公司。经向路桥公司了解，集灌路一期改造工程已完工，一期改造施工单位已撤场，现场没有管理人员，导致绿化杂草丛生。现集灌路提升改造工程即将启动，路桥公司也已完成施工招标，将安排施工单位于近期对全线绿化进行整理。,2015/6/9 10:16
建议,建设局,2015/6/3 21:06,拓宽集美区石鼓路,尊敬的领导：您好！近年来，随着车流量的增大，集美区石鼓路经常出现堵车现象，通常本是500米车程而行车却要等上半个小时以上，最近也时不时出现一些小事故。出于安全考虑，作为一个普通市民，想向您提一个小小的建议：拓宽集美区石鼓路，把车道拓宽为4车道。,关于石鼓路交通拥堵的现象，区政府相关领导及有关部门均非常重视，也曾经做过改造，也偿试过推动拓宽改造，但由于目前拆迁难度相当大，尚无法进行拓宽。感谢您的宝贵建议！,2015/6/10 11:11
