style,section,deliver_t,title,content,reply_c,reply_t
建议,交通局,2016/4/8 20:27,"914,915，927公交车在郭厝临时站设置的建议","关于对914,915，927公交车在郭厝临时站设置的建议，我们多次向厦门市公交管理部门反映，也向集美区分管的杨领导进行了面谈，都认为我们的建议是对的，但是迟迟没有解决，具体情况是,中航城C区914临时站牌叫郭厝,915，927公交车临时站郭厝社，没有站牌，两个车站相差百米左右，915，927在郭厝站不停，乘客站两个车站中间左顾右盼哪个车来了就跑步赶那个车，因为914,915车次比较少，半个小时一个车次，我们建议将914,915,927三个车的两个车站合并，我们乘车就方便些了，道路条件具备，不需要投资，不需要修改卫星导航，只要郭厝临时站牌上面增加915，927就行了，在我们提出合并的建议已经很久了，而且得到了市，区分管领导的认可，请不要再拖了，求求你们了。",我区公交站点建设由集美城发公司负责实施。关于民众反映的中航城C区内公交统一停靠问题，我局经办人员已与信访人进行当面沟通解释。目前我局已会同集美城发公司、公交公司进行现场勘察，近期内将对该站点进行统一完善。,2016/4/18 15:30
建议,交通局,2016/4/11 15:48,开通BRT到杏林的建议,看到有人建议BRT到杏林个人觉得确实很有必要杏林现在住着这么多人进岛都不怎么方便BRT到杏林工程量相对也还好对于杏林这边的居民确实很有必要,目前我市现有BRT线路均依托BRT专用道进行运营，目前我市已停止规划建设BRT，改为轨道交通建设。根据规划建设，轨道交通一号线在园博苑西门处设有站点，届时民众可至该处搭乘轨道交通出行。,2016/4/18 15:29
建议,交通局,2016/4/12 10:37,古龙御景公交问题的建议,能否帮忙解决下古龙御景居民的出行问题呢？Ｌ22完全可以从古龙御景一期里面进去的为什么不呢？959路线完全可以进入这个区的为什么没有呢？912路完全可以经过这里的为什么也没有呢？请政府帮忙解决下出行问题这里面也住着挺多老人妇女小孩子的毕竟这片区没有商场没有学校冷冷清清目前居民们购物、娱乐、上学、上班相当不方便有车的人毫不在乎没车的人辛辛苦苦土壕们不会住到这里来吊丝们很悲催走路到新华都二十分钟以上走路到ＢＲＴ二十分钟左右走路到凤林南站十五分钟走路到嘉庚体育馆站估计要二十五分钟了何况是带着小孩的妇女们老人们呢？这一带问题太多了请政府帮忙解决吧。,1、目前古龙御景周边有L21路及959路公交线路途经，L21路经停海凤路“凤林站”，959路于2015年下半年新增停靠浔江北路“凤林南站，建议民众可搭乘上述2条线路出行或换乘出行。,2016/4/19 10:50
建议,规划分局,2016/4/13 10:04,古龙御景空地规划的咨询,古龙御景周边一大片空地问题是如何规划的，古龙御景小区现在入住率已经较高了，周边的空地至今没有任何动静，以至于小区像孤岛般存在，周边配套跟不上，望尽快解决！,您好。根据《集美区空间布局规划》，古龙御景小区西侧、南侧大片空地规划用地性质为居住、中小学、商业、道路、绿地等。但该大片用地厦门市政府于1999年批给厦门东方国际文化影视有限公司作为东方快乐岛一期项目用地，红线编号为厦府[1999]地077号，土地用途为旅游。该土地属历史遗留问题，具体情况请咨询区政府及国土部门。,2016/4/14 11:24
建议,公安分局,2016/4/14 10:21,关于杏林桥头四大楼盘道路以及海边道路增设停车位的建议,四大楼盘，几万人挤在那点地方，两边道路都是停满了车，规划局、建设局目光短浅，海边道路狭小，仅两车道，偌大的楼盘，不计其数的车辆，严重阻碍了道路的通行，交通的安全，从长远看，应将海边道路的改扩建与滩涂改造相结合，提升道路与海滨景观，通过增设停车位，规范道路，提升集美。政府的钱要花在刀刃上，这些切切实实关系到我们群众的利益的生活，交通，安全，难道我们亲爱的集美区政府领导不应该去走走看看，调研调研。顺便投诉一下，从杏林往岛内的杏林大桥靠近杏东小学和禹州中央海岸二期，隔音屏障一直不装，去年附近的居民一直投诉跟建议，终究还是没有回应，没有行动。是不是该督促相关单位了。,我队会将此情况上报区道安办，建议依照该周边道路实际情况，勘察是否适合增设停车位。,2016/4/22 9:56
建议,公安分局,2016/4/14 11:45,关于莲花新城小区门口规划停车位线问题的建议,建议在莲花新城小区附近规划一些停车位让同事朋友来我家参观吃饭胡时候能临时停一下车，现在集美新城入住上班人越来越多，连个停车位都没有！物业为难业主没有买车库的不让业主车停地下车库，有设定一个店面停车点，都被物业及售楼处自己人停满了。业主只好停在外面小区门口，因集美新城真的一个停车位都没有，我都不知道开去哪里停，现在交警指标是不是太多了？每天都跑去集美新城贴单，真好贴，从灵玲马戏城到软件园三期一个临时停车线都没有。我如果乱停，交警就会来贴单，每天都是一张罚单，3分150，我每个月都要去重新学习培训！这怎么能吃得消！,关于信访人所提的在莲花新城小区附近规划停车位建议，我队建议莲花新城小区，停车资源较足，不宜再占用路面停车。,2016/4/20 15:45
建议,,2016/4/14 22:10,集美区政府网站是否可以改版！,时间的车轮也带我们走进了21世纪，可是这个文明世界的学村的政府网站还保持着10年前的版面，他需要更新，也需要换新颜，因为很多人回去关注它，作为特区的窗口，作为嘉庚的代表确让很多人无法去了解他，因为政府的网站太过于老旧很古板，看看各区的网站，请区领导也关心下自己的门面，去展现集美的美和集美的进步。替他换件时代的衣裳吧！,您好，感谢您关注集美区官方网站。集美区官方网站按照国家、省、市对政府门户网站建设提出的新要求与规范，平均每两年更新改版一次。近期是于2014年进行改版的，强化了网站“信息公开、办事服务、公众参与”三大功能，进一步增强服务功能。感谢您提出宝贵的意见和建议，请您继续关注和支持集美区官方网站，我们将一如既往地做好我们的工作，谢谢！,2016/4/20 11:36
建议,交通局,2016/4/15 10:14,集美杏北新城增加公交路线及班次的建议,集美杏北新城，晚上九点多公交车就没有，黑漆漆的一片，希望政府能够协调有关部门，增加进岛公交路线及班次，解决民众出行问题，谢谢。,1、杏北新城现有657路、680路、908路、921路、941路、942路等共计8条公交线路途经，民众可搭乘上述线路出行或换乘出行。,2016/4/25 16:43
建议,集美城发,2016/3/8 8:41,杏林消防队对面道路施工问题的建议,杏林西路，杏林消防队对面的路挖了，店铺老板又用几部车挡了唯一可通行的小骑楼。拨执法局电话60###65说明来意，接电话的同志叫我拨61###71，接通说要找市政，又拨62###35，再拨建设局62###17到市政科，建设局承诺，会联系相关部门尽早按规定铺上临时过道！建议如确实建设需要，可利用店铺的走廊通行，不过首先要确认这走廊属不属于店面所有的，是，就请求相关部门协调店铺经营者配合，不是，就要强行让出。,经现场查看，杏西路已移交厦门市政开发总公司进行提升改造，我司已将此情况上报区建设局，建议转区建设局协调处理。,2016/3/16 16:58
建议,"建设局,交通局",2016/3/8 18:13,关于大学康城公交首末站改造的建议,一、首末站改造问题；2015年集美区两会上，提出集美区公交便利工程实施计划，成为区长黄晓舟所承诺的十大民生工程之一。集美区计划今年开工建设7座公交枢纽首末站，包括大学康城公交首末站、侨英公交枢纽站。。。。以保障城市发展和人口增长的需求。时过一年，大学康城公交首末站提升改造末见有任何进展，为民办实事项目，不能只是空有承诺、并无行动；不能空有计划、末见落实。改造项目为何流产？二、建议增设大康--厦门北站、大康--会展中心公交线路。目前大学康城周边居住楼盘和工业企业众多，大学康城、康城芳邻、凤凰花城、新纪元、中海锦城、锦园村等周边和沿线常住人口达十几万之众，尚末开通到厦门北站、会展中心的公交，给居民工作、生活、出行带来极大的不便，周边居民强烈希望开通这二条公交线路。三、公交车统一增加闽南语播报，传承和弘扬闽南文化是人文集美的重要方面，建议凡区属9字头公交车必须用双语（国语、闽南语）或三语（国语、闽南语、英语）播报，体现集美的开放性、特色性、人文性。,1、我区公交场站建设由集美城发公司负责实施。经向该公司了解，原先规划建设的寨内公交场站由于在进场勘探时受到一些阻力，因此暂时无法实施。,2016/3/17 10:22
建议,侨英街道,2016/3/9 21:31,莲花尚院成立业主委员会的建议,集美区侨英街道-莲花尚院已于2013年09月30日交房（交房距今满2年有余），现大部分业主已经装修完毕自住或出租，东区开发建设单位委托的物业（白士德楼宇）与东区开发穿同条裤子，出现问题一再敷衍办事一味拖延（下雨天地下车库会漏水以各种理由推脱责任，下个中雨有家回不了家门口排水不畅淹了）再追究问题已经没有实质意义，已经熬过艰难的2年多了。为维护广大购房者利益，现恳请侨英街道办事处履行职责，负责组织成立首次业主大会筹备组，成立后由业委会与物业沟通管理事宜。盼能落实到位尽快组织成立，成立那天买串鞭炮到侨英街道办事处大门燃放，感谢党和政府的理解与支持！,经核实，莲花尚院小区目前已符合成立业主委员会条件，街道办将根据《厦门市物业管理若干规定》及实施细则落实各项工作。,2016/3/18 11:20
建议,教育局,2016/3/10 15:30,孩子进校时间灵活化的建议,天气突然气温骤降，还伴随着风雨，新源小学，早上7:30分，在寒风中静候校门开放的可怜的孩子，焦急地等着孩子进校门后要赶上班的家长。恳请希望看到此图片的相关责任人酌情考究！,感谢家长对我区教育事业的关心！经了解，新源小学早上开启校门时间是7:40，但导护师7:30就到位，导护领导会根据当天学生到校门和天气情况而灵活安排。欢迎家长提供更好的建议。,2016/3/15 9:46
建议,"公安分局,建设局,综合执法大队",2016/3/13 15:11,灌口派出所正后面僵尸车占道的投诉,灌口派出所正后面的围墙旁（靠近灌口医院这边的围墙），有一两部僵尸车长期占用人行横道。请相关部门处理。,综合执法大队:我队于22日上午派执勤人员到现场查看，僵尸车停放处附近的修车厂出来说该僵尸车是他们朋友停放的他会通知朋友来处理。22日下午我队通过查询到的车主电话再一次通知了车主，车主承诺自己会尽快前往处置，我队后续会继续跟踪处置情况。,2016/3/23 10:34
建议,规划分局,2016/3/13 22:37,杏滨路到新阳大桥杏林湾滩涂改造的建议,杏滨路到新阳大桥的杏林湾海边退潮后，涌现出污泥和滩涂的养殖杂乱无章，一道亮丽的风景线白白浪费了，希望改造成海滨浴场和海边自行车通道，完全可以改造和环岛路一样的景观！,集美区政府一直都很重视杏林大桥至新阳大桥段的滨海岸线的景观整治提升，2014年就组织我市优秀建筑和景观设计师开展景观提升规划设计征集，并评选和优化景观设计。因景观提升涉及滨海岸线局部利用海域，需报送海洋局批准后才可实施，原设计用海没有获得海洋局批准，区政府已安排区建设局与市海洋局沟通并调整设计方案，获得批准后将组织滩涂改造工作。,2016/3/16 10:40
建议,规划分局,2016/3/14 12:05,关于集美新城加快学校布局和建设的建议,近期看到很多有关集美新城加速集聚成城举措的新闻，非常令人振奋和激动，集美有很多像我们这样，从岛内到集美新城买房的市民，但是否能让这些市民放弃岛内户口，迁移到集美居住，很多的一个因素是孩子上学的问题，如果在集美能有好的学校好的上学机会，那就能真正吸引很多在集美置业的居民能来集美居住生活，否则依然会出现房子是卖了，但大量空置的现象，海沧在引进名校方面力度很大很实在，集美在这方面需要向海沧学习请教，偌大的一个集美新城，集美新城的核心区，到目前为止没有规范上档次的学校，这是极大的短板和不足，要集聚人气，要集聚成城，一定要让这些房子有人住，所以教育要先行。所以希望政府能尽快落地外国语学校的建设，能在集美的核心区建设与该城区相匹配的的学校，这样新城的发展才能又快又好,您好！按照《厦门市集美区11-11管理单元控制性详细规划》及《集美区中小学布局专项规划》，集美新城特别是核心区，学校规划配置是比较充裕的。外国语学校的建设政府正在统筹协调。,2016/3/24 15:20
建议,农林水利局,2016/3/14 22:28,鱼塘果园鸭舍等基础设施改造发展农家乐的咨询,尊敬的政府领导，我家是一户普通的农户。我父亲在三十年前就承包了村里的贫瘠地，开挖了鱼塘，在鱼塘边建了简易生活用房和一些鸭圈猪舍发展养殖业，这些已经经营了二十来年，养活了一家人。但近年来饲料价格上涨飞快，厦门这边发展养殖业已经不赚钱还容易污染环境。这一两年也听闻国家出台多项政策鼓励农民发展休闲农业。我家也想改建翻新原有的管理房和鸭舍这些老旧房子，想装修一下发展农家乐。可城管人员却三天两头地过来警告和威胁说老的房子不能改造，不能装修。那请问这些政府工作人员，我们没能力也不是要盖别墅也不是要盖楼房，我们只是想把这些会滴水的老房子换个屋顶，装修一下，好吸引客人来游玩，难道这样也不行吗。如果连改造原来老旧破败的基础设施都不行，那农民还怎样发展农村经济，农民的出路在哪里？难道要靠卖地或政府的救济吗？,请提供详细的投诉地址，以便我局派发中队处理。,2016/3/16 11:37
建议,灌口镇,2016/3/15 15:57,灌一新城配套运动设施的建议,灌口灌一新城现居民很多，建议配套一些运动器材，儿童游乐设施。,已将该建议转达相关部门，建议人也可向灌口第一社区居委会建议，由第一社区向上级部门申请完善社区文体设施建设。,2016/3/21 11:24
建议,规划分局,2016/3/17 8:45,打通灌南到杏西道路的建议,杏西灌南都是工业区，已经发展很久了，可是这2个地方之间竟然没有道路联通，得绕弯靠集灌路，杏西和灌南之间就像湾区一样！虽然有铁路高速路通过，但是都是可解决的，从地图上看，这边区域真是城市规划之败笔！另外吐槽下杏西广场，无论从外观看还是内在格局装修，都是乡镇水平！身边每个人都在吐槽那个杏西广场！造成今天招商难根源就在自己就看不起自己，弄个乡下的东西出来！,您好！您关心的连接灌南工业区与杏西工业区有一条规划道路，规划路从灌口南路连接海翔大道或连接杏美路再接杏西工业区。灌口南路与杏美路均已规划。感谢您对城市规划的关心与支持。,2016/3/25 11:17
建议,行政服务中心,2016/3/18 18:25,关于打印首套房证明的建议,本周每天都去政务中心办理首套房证明，排队的人都让人觉得要命，一周了这个证明还没排上队。主要原因：办事窗口少，打证明的简单时间快却要和办理产权业务的在一起，等不起啊。单打证明手续齐全应该1分钟就能完成吧，办理产权证或者过户之类的每位差不多要半小时啊，能否分开办理呀？还有其实这类证明在网上为什么不能自己打印呢？,不动产中心窗口为综合业务受理窗口，通过政务中心的取号系统按顺序叫号受理，满足群众各类办事需求。您反映的开具首购唯一证明提速增效的问题，我中心将于近期推出自助查询打印证明机，届时群众可自助开具首套、二套及唯一住房证明。,2016/4/7 15:39
建议,公安分局,2016/3/22 8:18,浔江北路与海凤路交叉路口增设红绿灯的建议,由于该交叉路口是乐海小学、集美中学、喜盈门和附近小区居民的必经之地，每天上下学和上下班高峰期，尤其是早上七点半左右，该路口因为没有红绿灯，交通一片混乱，左转的不让右转的，转弯的不让直行的，每次经过该路口都提心吊胆的，因为接送孩子的车很多，存在很大的安全隐患，敬请相关部门重视，该路口增设红绿灯已是迫在眉睫。,关于信访人建议在浔江北路与海凤路交叉路口增设红绿灯，我队组织人员对浔江北路与海凤路交叉路口进行了现场勘查，拟在该路口设置红绿灯。,2016/3/25 11:13
建议,交通局,2016/3/22 16:30,海上五月花、海德公园小区交通问题的建议,目前集美区北部新城海上五月花和海德公园两个小区的入住率已经很高，可是附近没有公交线路，要走15分钟到TDK坐公交，非常不方便。连接小区的最后一公里问题急需解决！（实际离最近公交超过一公里了！）最好是能经过嘉庚体育馆的，这样大大方便了市民出行！,1、鉴于目前乐天路已打通，912路将在近期内开通运营，该线路将衔接区行政服务中心。,2016/3/30 10:17
建议,灌口镇,2016/3/22 22:26,MD###0091问题的咨询,投诉的问题流水号为MD###0091，查询号为67##60，为什么不给予答复？把公开件变成了不予公开。我们有监督权，发生了争议和诉求，人民政府应该正确面对并予以答复，而不是回避问题，法治社会，政府更要依法行政。老百姓的法治意识提高了，不正是党中央和各级政府希望看到的吗？希望能就之前的诉求能够给予正面、公开的答复！让老百姓看到一个依法行政、为人民服务的人民政府，谢谢！,目前陈井村征地地块属于国有滩涂，面积约四千五百亩，地类属于耕地。根据《厦门市人民政府关于完善征地拆迁政策的若干意见》（厦府〔2005〕176号）、《厦门市人民政府办公厅转发市国土房产局关于制定征地拆迁具体实施细则的指导意见的通知》（厦府办〔2005〕213号）、《厦门市集美区完善征地拆迁政策若干意见的实施细则》（集府〔2005〕102号）等有关规定进行征拆补偿。村委会已召开过村民代表大会研究通过了分配方案并且加盖手印。被征地的所有权人正在登记中，所有程序均经过公开公示，不存在暗箱操作行为。,2016/3/24 11:11
建议,交通局,2016/3/24 9:47,关于海上五月花交通的建议,据说海上五月花开通到软件园三期的公交，但是没有经过嘉庚体育馆，集美老城区一带。建议开通一路海上五月花途径嘉庚体育馆至集美学村的社区公交，途径嘉庚体育馆，方便居民出行转车，就医等。或者延伸959公交至海上五月花也可以的。,1、鉴于目前乐天路已打通，912路将在近期内开通运营，该线路将衔接区行政服务中心。,2016/3/31 11:26
建议,公安分局,2016/3/24 16:43,关于内林村公路局道路停车问题的建议,内林村公路局那条路每天都停满了车，现在往内茂的路在改造，建大桥，很多车都直接开往内林村公路局这条路进出，连公交车也开进来，两边都停满了车，路都堵住了，村民自己出行都不方便，连摩托车都骑不出去，有时一堵都要堵个半小时以上，希望相关部门可以整治下，不要两边都停车，可以留一边，方便两辆车交错通行，这样就不会造成拥堵。可以借鉴杏林村，划线，把车停在该停在位置，未按线内停放，采取相关措施执行。,我队会派人到现场勘察，并加强管理。,2016/3/31 11:24
建议,公路分局,2016/3/24 17:10,海翔大道西滨立交到孚莲路段安全隐患的建议,海翔大道可以说分两部分，（集美西滨立交到翔安段），（西滨立交到孚莲路段），同一条路为何展示在市民面前是两种面貌，这里主要说的是西滨立交到孚莲路段，路面破损严重，坑坑洼洼，单就昨天在该路段经过然后车胎爆掉的数量就起码20辆（补胎师傅统计的），严重威胁到周边市民生产经营的安全！车胎爆的瞬间如果失控那该多严重！！还有另一严重安全隐患，该路段自从通车到今，路灯是安装好了，不过那都是摆设！通车至今该路段路灯从未点亮过！建议有关部门为周边市民着想，把路面修复好，把路灯点亮。如果你处理不了，那么你可以帮助市民把这反馈到你的上一级去。感谢！,该转办件所述涉及海翔大道二期完善工程，代建单位为厦门百城建设投资有限公司。经向百城公司了解，因该段道路重车较多，对路面损坏较大，道路拓宽施工期间，百城项目部已安排施工单位进行修补，灌前立交跨海翔大道桥梁施工预计4月份进行支架拆除，拆除后将对处路面进行修复，届时将可以改善此处交通。关于海翔大道公铁立交至孚莲路段路灯不亮的去问题，目前相关用电手续正在办理，预计7月份可完成新路灯箱变安装。,2016/4/6 11:43
建议,区直机关党工委,2016/3/25 10:30,关于区直机关工会办理户外运动卡的建议,建议区直机关办理户外运动卡的直系亲属应放宽至父母，直系亲属本应包括父母，子女等，为什么只能为子女办理不能为父母办理。,根据进一步规范工会经费使用有关规定精神和具体操作流程，目前不宜扩大对象,2016/3/29 9:39
建议,交通局,2016/3/25 12:49,中航城C区公交问题的建议,现在中航城C区出行很不方便，1.914和915、927分别停在不同地方，中间间隔有上百米，建议合并为一个站点，方便出行。2.因为914和915的班次较少，建议927在灵玲马戏城停靠，方便在那边转车。,关于914路、915路、927路公交停靠点统一问题，我局近期将会同公交公司、场站建设单位进行现场勘查，结合线路运营情况将停靠站点进行统一。,2016/4/1 11:27
建议,交通局,2016/1/21 12:58,开通北站直达同安BRT的建议,北站到同安没有直接BRT，是否能改造集美大桥头？开通北站直达同安的BRT,BRT线路的开通运营由市快速公交运营公司负责，建议向该公司或市交通主管部门反映。,2016/1/27 15:19
建议,交通局,2016/1/21 17:12,改善集美交通工具的建议,集美的交通工具都是摩的能改善下引进的士吗？随便出行做摩的都是要8块的近一点也是要6块可以多加2元坐的士不是更安全吗？岛外一出现就是摩托车成群不然就是黑车，很少看到的士的声影，既然岛内外一体化的话，该改善的要改善啊改引进的要引进啊，不然什么时候才真正的岛内外一体化呢？岛内随处可见都是的士，岛外随处可见就是摩的，连的士的影子都没有见到？请问集美区政府有重视这个问题吗？,您好，目前我市出租车实行总量控制，相应的经营权需经市级政府审批。目前集美区共有200部出租车辆，岛外其他各区为100部。经向出租车公司了解，受岛外人流量的影响，目前岛外出租汽车较少采用路面巡游的模式进行揽客，多数集中在火车站、长途车站、大型超市等区域候客。,2016/2/1 9:15
