style,section,deliver_t,title,content,reply_c,reply_t
建议,公安分局,2012/9/28 22:21,关于灌口第二社区群众安全的建议,我是灌口镇第二社区的居民，近些日子在第一社区跟第二社区接连发生了太多起持械抢劫的事件，（已有第一社区居民在，我要投诉栏目编号MD###1295中反映过类似问题）。特别是在“打棉街”小叮当幼儿园到灌口实小后门和前门路段，这个月已经发生了4起抢劫事件，有持刀的，也有用电棍的。就在我写这封信的30分钟前又发生了一起抢劫手机的事件。这些事件已经严重的影响到了人民群众的日常生活跟人身安全，让社区的群众人心惶惶，谈虎色变。,调查情况：接此举报信后，我所于10月9日下午再次组织村干部召开辖区警情通报会，通报辖区近期发案情况，分析发案规律，引起村居干部的重视，并协同村（居）委会联合向镇综治办反应情况，申请巡逻经费。近期，我所组织安排村居护村队、老人巡逻队等群防群治力量，分3班24小时轮流巡逻，同时加大派出所警力投入，安排协警加强对辖区的动态巡逻，提高见警率，压缩犯罪空间。同时，10月8日我所社区民警深入灌口第二社区打棉街一带走访附近居民，听取收集群众意见。,2012/10/16 10:10
建议,执法局,2012/9/29 8:20,关于对危房该不该让建房的建议,灌口镇654号对面的杜。。。建房，现竟遭举报！！呼吁有关部门能落实后处理。,经查，当事人杜**，在灌口镇李林村李林社657号对面进行建设，占地面积113.15平方米，现状砖混结构，二层封顶；执法人员于2012年7月19日巡查发现并制止，开具《责令停止违法建设通知书》NO：3004589号，责令停止违法建行为，当事人提供一份2010年的《危房户、特困户建筑调查审核表》。,2012/10/16 15:21
建议,"建设局,集美街道,城管办,集美街道,城管办",2012/10/8 10:19,集源路建行门口绿化树的建议,集源路改造时在建设银行门口补种了几棵绿化树，可是有一棵死了，建议绿化部门及时新种一棵。,我办已联系施工单位重新补种。,2012/11/5 16:17
建议,,2012/10/8 10:22,建设银行ATM不够人性化,集源路建设银行在靠盛光路一侧设置了几个ATM存取款机方便了市民，可是这几个操作间是全封闭的，在里面操作时奇热无比，不够人性化，建议建设银行改善一下。,建设银行ATM设置问题建议市民直接向该建设银行反映。,2012/10/8 10:24
建议,教育局,2012/10/10 12:10,关于集美小学教学问题的建议,"一直以来,我不知道是个别班级还是学校就是这样的风气.学生总是会把一些复习材料拿回家,要家长帮忙复印,一次就是整个班级的材料.如果个别家中或者是家长工作的地方有复印机那还好,要是没有,家长就得拿到店面去,虽然几十张下来只是小钱,但是老师这样叫学生做事,我不知道到底是对还是错.而且每个班级不是都有一定的班费吗?为什么一定得安排每个学生轮流把材料拿回家复印.或许这只是一件小事,但长久以来,有些老师也习惯了,学生家长也不得不默认了这样的作法，因为害怕如果学生拒绝了，老师会不会有其他的看法。",经了解，集美小学的学习资料复印，一般是由学校速印室根据教师的教学需要来提供。今年，由于学校原校舍加固中，全校师生暂时搬迁至集美中学南熏楼、黎明楼开展教学活动，办公条件大不如前，速印机在搬迁过程中受损，常会出故障，有时会影响速印进度，于是就出现了个别班级个别老师让班上同学轮流承担复印工作的做法，对此，学校已在教师大会上进行了规范、宣传及教育，要求老师改正错误做法，确保今后不再出现类似管理疏漏。,2012/10/16 10:05
建议,执法局,2012/10/10 12:29,李**654号对面违建的建议,首先对执法局的全体工作人员致敬，为了维护社会的有序运行，你们辛苦了。在此我想对执法局的执法提个建议。之前听说李林村654号对面杜**的违建被执法局制止了。我就是他们的邻居，他们一家人都很淳朴，他们家一栋房子都没建，一家族十几个人住在已是危房的老房子里面，住房条件很差。想请执法局的同志去核实一下，询问他们的邻居、他们的村长，书记等村领导。因为住房条件实在是太差了，现在想盖栋房子改善一下居住条件，一直被投诉，执法局也多次制止其建房行为。他确实没有批建手续，执法局的执法行为也是非常正确的，不然社会就乱了，杜**也不想给执法局添麻烦，而且他们一家人也都很善良，平时也都乐于助人，法不外乎人情，希望政府给他们一次改善住房的条件的机会。,经查，当事人杜**，在灌口镇李林村李林社657号对面进行建设，占地面积113.15平方米，现状砖混结构，二层封顶；执法人员于2012年7月19日巡查发现并制止，开具《责令停止违法建设通知书》NO：3004589号，责令停止违法建行为，当事人提供一份2010年的《危房户、特困户建筑调查审核表》。,2012/10/16 15:13
建议,建设局,2012/10/10 14:38,灌南工业区941.942公交车靠站的建议,我想请问下，为什么现在灌南工业区941.942公交车经过集美，但就是不停靠，为什么集美就没有站了，这样很不方便我们老百姓出行，到集美还要转2次车，真的大家都对此觉得无法理解，请有关部门落实，谢谢,941路、942路公交车属厦门公交集团海沧分公司管理，建议市民直接向海沧相关部门反映。,2012/10/10 17:19
建议,杏林街道,2012/10/10 18:52,关于对文华路1、5、9号污水管道改造工程的建议,"非常高兴,针对文华路1、5、9号污水管道改造工程确定并开始动工,想到不久后就能告别糟糕的小区环境,非常的感谢杏林街道对民生的关心.现在改造正在进行中,但文华路1号,一用储物间非法改造的花店非法占用了公共用地,而且不配合整体改造,如不对非法占有用地同时进行改造,恐对整个改造效果造成严重影响,同时文华路1、5、9号处于文华路和杏东路相交处,改造将大大改善片区整体环境景观，因此真心希望能够彻底地改造。",改造项目有设计、有立项，您所反映的问题是否在改造范围，可现场同施工单位核对，如在施工范围内，施工单位严格按设计要求进行。,2012/10/12 10:42
建议,市场监督管理局,2012/10/11 19:57,杏林街道内林村内中里213号旁黑网吧抓了又开的投诉,位于杏林街道内林村内中里213号旁边那栋没粉刷的5层楼第一层是间黑网吧，楼下有个玻璃门进去就是黑网吧。开学后每天都下午2点后才开始营业。{就在内林村雯欣幼儿园旁边}我是外来务工人员家里不到10岁的孩子经常去这家黑网吧上网。此黑吧抓了又开始营业了。,杏林工商所工作人员于10月17日上午到该场所进行调查、取证后，反馈内容如下：,2012/10/23 15:00
建议,建设局,2012/10/12 13:43,关于在集美二小对面的浔江路建一座人行天桥的建议,集美第二小学对面的浔江路，车流量大，车速快，又是孩子们的必经之路，目前无一座人行天桥，存在严重安全隐患，因此建议在集美第二小学对面的浔江路建一座人行天桥。,经勘查浔江路正常时段车流尚未达到双向当量小汽车1200pcu/h，或过街行人超过5000p/h的交通量，目前尚未具备修建人行天桥或地下通道的条件。如涉及学生过街交通安全问题需增设红绿灯或行人斑马线，该市民可直接与交警部门联系。,2012/10/15 10:15
建议,执法局,2012/10/14 21:46,关于对孙厝乐安西69号违建秉公处理的建议,集美孙厝乐安西69号人家是本分老实的公民，却因为一些无良的人恶意诽谤，恶意投诉，导致房子到现在都建不起来，两位年迈的老人家无处安身。一样都是人，一样都有人在盖房子，人家还是借的钱想改善一下居住的环境而已，为什么就不能放过这善良的一家呢，房子刚建一点城管就死命的砸，可怜可怜这两位老人家吧，不信的话可以去问问那附近的邻居，看是不是真的属实，让百姓有个地方安身，这不是我们政府一直倡导的吗，怎么现在说的跟做的却恰恰相反呢，请让居者有其屋吧，拜托了,经查，乐安西里69号孙**于2012年5月份拆旧房(原三层)进行翻建，因手续不完整，我局侨英中队于2012年6月21日对其违建房屋进行强制拆除，之后保持原状。现当事人又继续抢建第四层墙体，中队已制止。投诉人所反映的情况与实际情况不相符，望看了以上陈述理解我们的工作。,2012/10/19 17:03
建议,杏林街道,2012/10/17 10:41,杏林村篮球场停车的建议,我们是住在篮球场附近的居民，篮球场附近都没什么地方停车，菜市场旁的黑砖场可以用来停车，可是老人协会拿来手摊位费，这几天篮球场都不让停车了，你叫我们住附近怎么停车，望村委会解决一下,篮球场是村民举办文体活动的场所，不适合用来停车。鉴于停车难，已向上级申请资金建设菜市场旁的黑砖厂，拟作为停车场。,2012/10/24 10:09
建议,建设局,2012/10/18 14:15,922线路增加站点或增开BRT链接线的建议,922的线路开始延伸到经贸学校，接下来一站就是东山村。,1、目前途经东山村的公交线路有905路，民众可搭乘该线路车辆出行或换乘出行。,2012/10/29 11:29
建议,杏林街道,2012/10/20 16:53,关于给正在开发中的西亭选个好领导的建议,有道是“新官上任三把火”，可是我们社区的领导上任那三把火不是烧向西亭新城建设这个重任上，也不是烧向为社区居民办实事这个重任上，而是烧向排除异己西亭的同胞身上然后迫不及待的安插自己的人身上。三年一次换届选举试问有哪个社区有哪个领导在开除员工呢？搞得整个社区工作环境乌烟瘴气、人心惶惶。百姓议论纷纷“哪天不小心得罪了村领导，领导会不会给我小鞋穿，会不会把我的赔偿款....，那后果....”民心不安定，安全感从何而来？有道是“海纳百川，有容乃大”试问这种胸襟狭小的人怎能做社区的领导？以后怎能管理正在开发中的西亭村呢？百姓又怎敢相信这样的领导呢？西亭不需要这样的领导，也不需要只会制造危机却不会处理危机的领导。在社区居民代表换届选举中，西亭社区9组因某领导处理问题不当，造成要二次选举，当中发生多次冲突，但某领导害怕如鼠，这事在西亭社区中产生很大负面影响，试问开发中的西亭以后将面临多少突如其来的问题，而这种遇事无担当的领导村民不需要，现在西亭正在大开发，西亭需要一个有魄力、有担当的领导，有道是“治盛世用文，治乱世宜用武”，请上级帮西亭选一个熟悉西亭环境、爱西亭子民的西亭人做我们的领导。,经了解，社区人员变动属于社区工作中部分人事调整，并选择将年轻、有能力、有知识、积极上进的人员留在社区协助工作。,2012/10/30 16:36
建议,"杏林街道,民政局,建设局,公安分局,杏林街道",2012/10/29 10:59,关于集美新城道路指示牌路名的咨询,按照集美新城的规划控规修订图上西亭安置房和中航城南边的那条路应该是“立言路”，但是杏林湾路上的指示牌却是“立信路”。这个路名与另外两条“立功路”和“立德路”是配套命名的，这来自于中国传统所谓的三不朽，也就是出自《左传》的“太上有立德，其次有立功，其次有立言，虽久不废，此之谓三不朽。”个人建议用保留原来规划的“立言路”。,经向民政局了解，集美新城市政配套道路已于2011年4月份完成命名，其中包括立德路、立功路、立言路。立言路目前还没有建成，待建成符合设立路牌时，民政局会对该路进行正式立牌。目前“立信路”指示牌为相关部门误写。,2013/1/4 15:35
建议,"规划分局,建设局",2012/10/30 15:43,关于集美北部新城建设进度的建议,集美北部新城自规划至今至少已有四五年，但是雷声大、雨点小。目前所呈现出来的情况是各项工作进度极度缓慢、几乎处于停滞状态，北部新城依然大部分处于空白阶段。,集美北部新城的建设正在逐步推进，今年在建的项目主要有三个：纵三路、纵五路及南二路，基本上不涉及拆迁及规划问题的市政项目均已建成或在建。进度缓慢有两方面的原因：一、征地拆迁难度大；二、市政综合管廊规划与原规划的冲突。,2012/11/5 15:58
建议,执法局,2012/10/30 16:34,危房为何不让建房的咨询,灌口上塘村大路墘社小燕子幼儿园一直进去到底建房，现竟遭举报！！希望相关部门能落实后处理。,"经查，当事人陈**；在灌口镇上塘村大路乾251号对面进行建设，占地面积294.5平方米，现状一层模板，因现场未能提供审批手续，执法人员进行制止，开具《责令停止违法建设通知书》NO:3005139HAO,责令当事人立即停止建设，携带相关手续到中队接受调查，目前，该建设已停止施工。",2012/11/15 9:56
建议,教育局,2012/10/31 8:59,关于学校设立意见箱及校领导接待日制度的建议,现在很多中小学生家长反映对有关学校及周边相关问题缺乏家校沟通的有效渠道，很多问题得不到反映与改善。,目前各个学校都有设立意见箱。至于设立校领导接待日问题，由于学校领导基本上都在学校，随时都可以接待家长反映问题，家长有事可以直接到学校或电话联系校领导反映沟通，同时各校还有家长会、家委会等沟通渠道，我们认为目前没必要设立校领导接待日制度。感谢家长对教育事业的关心和关注。,2012/11/8 16:29
建议,杏林建发,2012/8/21 8:39,关于金海湾小区配套会所须开放供业主使用的建议,小区配套会所应是业主运动、休闲的好场所，金海湾小区配套会所当时是否开发商宣传的卖点之一？为何至今未开放供业主使用？,:在购房合同附件中有明确约定:会所所有权属我司。,2012/8/28 17:18
建议,公安分局,2012/8/21 8:41,关于在文达路靠上岛咖啡旁的十字路口加划人行斑马线的建议,文达路靠上岛咖啡旁的十字路口属人员往来密集区，请管理部门加划斑马线以明确责任，减少车辆与行人抢道的危险，使人车混行的不良状况得以改善。,关于在文达路靠上岛咖啡旁的十字路口加划人行斑马线的建议，我队根据分局领导的批示精神，经领导现场察看，采纳其意见，并协调施工单位于8月28日完成了该路口增加人行斑马线的施划工作。,2012/8/28 17:15
建议,建设局,2012/8/23 11:06,关于村村通公交车的建议,都说要便民，村村通公交车，真的是这样吗？？？现在陈井村、浦林村等周边的村庄都通了到灌口的公交车，可是到杏林的公交车一辆都没有，而事实上附近几个村庄的村民很多都在杏林工作，或者是需要到杏林坐车到岛内等各地工作，现在只要是要到杏林就必须自己乘坐摩托车，这样的话不仅安全是个问题，下雨天更是非常不方便，而且陈井至西滨路段经常淹水，摩托车经常抛锚，必须要绕道从灌口走，这样不仅延误了上班时间，甚至到了上班的地方浑身已湿透了，每每这样，心里总是会怪政府，为什么不能为我们开通公交车呢，开通了公交车真的是不管晴雨天气，都不用发愁了，希望政府真的能从便民的角度出发，多听听民意，为陈井村、浦林村等周边村庄开通至杏林的公交车，真正做到为民办实事、便民。。而不要只是开空头支票，让我们翘首以盼。。。。。。,1、932路（陈井—双岭塔山边）公交线路若由陈井村延伸至杏林西滨村周边，途中需行经一座小桥（西滨桥）。该桥现为危桥，且较为狭窄，只能单向通行车辆，公交车辆在此路段运行存在安全隐患。,2012/9/4 17:17
建议,公路分局,2012/8/23 11:11,关于对杏林西滨立交桥上下桥路口要尽快修补的建议,杏林正新前面那座立西滨交桥上下桥路口都有很大的洞（往灌口方向下桥的路口有不小的洞），特别是从杏前路要往正新方向走上桥的那个路口洞特别大，白天开车就都要很小心，否则底盘会被刮到；如果是晚上开车的话，视线就更不清楚，小车肯定会卡在那个洞里，这不仅会造成交通拥堵，也会损害到爱车，强烈建议尽快修补。,市民所反映的路面破损问题，主要为杏前路与西滨立交各匝道连接处，杏前路目前正进行拓宽改造，经我局咨询杏前路业主单位市路桥集团：西滨立交匝道范围内由于各管线的单位施工导致破损，下雨冲刷后形成路坑，影响交通。目前南侧管线单位已实施完毕，市路桥集团公司集灌项目部将于近期修复南侧破损路坑；北侧由于水务集团管线还未实施完毕，水务集团实施完毕，路桥公司集灌项目部将立即修复。,2012/8/28 17:01
建议,建设局,2012/8/23 14:44,金海湾小区物业服务与收费对称问题的建议,1、物业要收服务费似乎有理，但前提是要为业主提供相对称的服务并维护业主的正当权益才对，何况服务费定得老高，服务应做得很好才说得过去！,物业公司都是依据《厦门住宅物业服务等级标准及收费指导价》的相关文件来收取物业费，若业主有疑问，建议向物价局咨询。物业公司各岗位工作人员都有经过相关的培训，定期派往厦门保安公司接受培训，有关的合同及物业服务标准已在项目部的前台公示，业主可前往查看。关于物业服务欠佳，我局已责成物业加强相关方面的工作。,2012/8/30 9:00
建议,,2012/8/26 23:12,请问政府部门如何保障我们的网上投诉的网络安全,请问相关人员如果我们用自己家电脑上网举报非法行为，政府是否能为我们的安全隐私做保障，保证我们的IP地址不被查询，并且不被被举报人所知晓并报复我们，毕竟我们是弱小的群体，有些事情无能为力，需要通过政府网络来举报某些不法行为的人某些不法行为的事某些不法行为的利益，而我们的人身安全又很难被保障，我们希望如果我们网络举报不法的行为活动，政府能够为我们的安全隐私我们的IP做安全措施不被被举报的人所查询和知晓，我们希望你们能够落实网络责任人制度，立即要求相关人员保障发帖人的IP地址不被查询，马上落实责任制度，保障普通农民的合法利益，推进社会的和谐进步，确实保护我们IP的隐私权,您好，我们在事件办理中本着尊重与保护个人隐私的原则，在转办的全流程中，IP地址全程保密，办理单位、办理人员均无权限查看IP地址，请市民放心。,2012/8/27 9:08
建议,市场监督管理局,2012/8/28 16:44,杏林街道内林村内中里213号旁黑吧的投诉,位于杏林街道内林村内中里213号旁边那栋没粉刷的5层楼第一层是间黑网吧，楼下有个玻璃门进去就是黑网吧每天都下午2点后才开始营业。{就在内林村雯欣幼儿园旁边}我是外来务工人员家里不到10岁的孩子经常去这家黑网吧上网。,杏林工商所工作人员吕仁国、卓开资等于9月6日到该场所进行调查、取证后，反馈内容如下：,2012/9/10 9:18
建议,城管办,2012/8/30 16:30,集美大学至厦门大桥这段景观改造的建议,每次驱车走同集路回岛内，从长途汽车站开始，右手边的景致形成强大的景观对比，破烂的民屋，摩的乱穿。后面还有个万达，朋友都说这环境那么差，万达怎么能作起来，也不知道政府不把这里改造下呢？,银江路（同集路南段）景观综合整治，市政府已研究确定，近期可开工建设。,2012/9/19 16:33
建议,建设局,2012/8/31 11:24,关于延长集美小学公交线路的建议,高峰期，集美小学附近的公交就很难挤上去了。新学期，集美小学师生搬到集美中学南薰楼上课，水产学院站离南薰楼直线距离约2公里，呼吁关注一下这个难题。,一、目前途经石鼓路集美小学共有901路、903路、921路、922路、923路、929路、935路、959路、961路、L22路10条公交线路，已基本能满足周边民众出行需求，且高峰时段所有公交线路运营班次均已加密。但受高峰时段客流量激增及道路通行状况等因素的影响，造成车厢内拥挤，乘车较为不便，敬请民众予以谅解，也希望民众尽量能够错锋出行。,2012/9/7 15:43
建议,集美街道,2012/9/1 19:25,石鼓路道路整顿的建议,每次到石鼓路，都觉得与百年学村不相匹配，路面拥堵，街道垃圾到处都是，尤其是那满是油污的人行道！请求政府相关部门做出清理整顿，为集美学村打造名誉的同时，首先保证有个舒适，清洁的环境，感谢建设和谐美好的集美名片，打造全国文明街道！,据执法中队和环卫站反馈，石鼓路存在问题主要是嘉庚路口至龙舟池段，针对该路段的市容市貌环境卫生问题，一方面街道环卫站将加强对该路段的保洁力度，及时清理道路垃圾；另一方面执法中队也将督促沿街店面店家做好“门前三包”，加强对主干道集源路、石鼓路、过境公路及旅游沿线、市场周边等重点区域巡查的执法力度和密度。,2012/10/15 11:09
建议,集美城发,2012/9/3 17:01,集美中学高中新校区路灯何时能亮的咨询,集美中学附近通往浔江路、天凤路的路灯都在暑期都安装好了，如今学校也开学了，为何路灯还不亮？晚上接送学生黑黑的，很危险。希望相关的管理部门能让路灯尽快亮起来！！,因前段时间文明城市检查及“98”投洽会影响电力施工进度；目前已基本完成，下周将可实现亮灯。,2012/9/11 10:06
建议,执法局,2012/9/5 23:14,关于对李林村违建普遍的建议,李林村贫富不均，有关系五六层在建，厂房俩三千平铁皮厂房在建，普通农民建房不是推墙体要不就是敲板，顶多就建俩层，厂房一搭就拆，这是什么世道。请政府为我们这些平民主持公道。谢谢。,经查，李林村目前未发现高层在建建设及大面积的铁皮厂房。我局灌口中队执法人员是依据相关法律法规查处违法建设的，投诉人所反映的内容较为笼统，我局灌口中队将进一步排查，同时建议投诉人反映具体的情况，以便我中队及时、准确的进行查处。,2012/9/17 11:53
建议,市场监督管理局,2012/9/6 16:15,内林村内中里213号旁黑网吧的投诉,位于杏林街道内林村内中里213号旁边那栋没粉刷的5层楼第一层是间黑网吧，楼下有个玻璃门进去就是黑网吧。开学后每天都下午2点后才开始营业。{就在内林村雯欣幼儿园旁边}我是外来务工人员家里不到10岁的孩子经常去这家黑网吧上网。,杏林工商所工作人员于9月6日到该场所进行调查、取证后，反馈内容如下：,2012/9/17 11:46
建议,建设局,2012/9/11 17:50,集美中学高中部周边道路路灯何时亮的咨询,看到政府回复获悉浔江路、海凤路近期会亮灯，请问集美建设局负责的高中部周边道路路灯何时亮灯，已经立杆快一年了！！另外泉舜泉水湾周边的25号路何时亮灯，居民已入住1年多了，,高中部周边路灯项目现正办理供电相关手续，预计年底前亮灯。25号路灯预计将于2013年上半年完工。,2012/9/18 15:53
建议,执法局,2012/9/14 9:00,灌口三社西蔡香厂旁蔡水笔违建的投诉,为什么在香厂旁边的厂房都被彻底拆除，而在香厂旁池塘旁边蔡水笔，能占用公家耕地猖狂推土，准备违法抢建。希望政府公平执法！,经查，当事人蔡**，在灌口镇三社村西蔡香厂后面的鱼塘管理房旁挖掘排水沟，尚未发现在建的违章建设，下一步，我局灌口中队将加强该区域的巡查监控。,2012/9/26 11:14
